"artist_name","track_name","release_date","genre","lyrics"
"TWICE","MOONLIGHT SUNRISE","2023","K-Pop","Oh, yeah I guarantee I got ya I've been craving for your love Can't see nobody but us (Can't see nobody but us) So I, so I, so I See you from across the room Make my way over to you (My way over to you) I'm trippin' over butterflies Oh, yeah Baby, I don't really mean to rush But I'ma really need your touch If I'ma make it through the night I got the moonlight Tequila sunrise Uh, come take a shot on me, I got ya I don't know how to say this I hope this song's on your playlist This feeling's so hard to explain I don't even know how to talk right now It's ""I need you"" o'clock right now I want you to hear me say Moonlight sunrise Baby, come be my starlight Moonlight sunrise Oh, baby, just to make you stay Moonlight sunrise Baby, let's do it all night Moonlight sunrise I guarantee I got ya Loving undefeated, on your knees pleading Baby, you can hit up my line when you need it Said that you tried? Baby, you succeeded Got a craving, baby, can you feed it? Took a trip under moonlight Follow me to the sunrise Everyday, every night Ayy, come with me, don't think twice Oh, yeah (Oh, yeah) Baby, I don't really mean to rush But I'ma really need your touch If I'ma make it through the night I got the moonlight Tequila sunrise Ha, come take a shot on me, I got ya I don't know how to say this I hope this song's on your playlist This feeling's so hard to explain I don't even know how to talk right now It's ""I need you"" o'clock right now I want you to hear me say Moonlight sunrise Baby, come be my starlight Moonlight sunrise Oh, baby, just to make you stay Moonlight sunrise Baby, let's do it all night Moonlight sunrise I guarantee I got ya Cards out on the table, what you say? I need you, you need me, you're mine I'm your moonlight, you're my sunrise, babe I guarantee I got ya Moonlight sunrise (Oh) Baby, come be my starlight (Oh, yeah) Moonlight sunrise Oh, baby, just to make you stay (Oh, yeah) Moonlight sunrise Baby, let's do it all night (Baby, let's do it all night) Moonlight sunrise (Oh, yeah) I guarantee I got ya (Oh-oh) Moonlight sunrise Baby, come be my starlight (*Ah-ah-ah*) Moonlight sunrise (*Ooh-ooh*) I guarantee I got ya (*Moonlight sunrise*) Moonlight sunrise (*Moonlight*) Baby, let's do it all night (*Sunrise*) Moonlight sunrise (*Oh, yeah, yeah*) I guarantee I got ya (*I guarantee I got ya*) Moonlight sunrise"
"TWICE","TT","2016","K-Pop","이러지도 못하는데 저러지도 못하네 그저 바라보며, ""Ba-ba-ba-baby"" 매일 상상만 해 이름과 함께 쓱 말을 놨네, baby 아직 우린 모르는 사인데 아무거나 걸쳐도 아름다워 거울 속 단 둘이서 하는 fashion show, show 이번에 정말 꼭꼭 내가 먼저 talk, talk 다짐뿐인 걸, 매번 다짐뿐인 걸 Na-na-na, na-na-na-na 콧노래가 나오다가 나도 몰래 눈물 날 것 같아, 아닌 것 같아 내가 아닌 것 같아 I love you so much 이미 난 다 컸다고 생각하는데 어쩌면 내 맘인데 왜 내 맘대로 할 수 없는 건 왜? 밀어내려고 하면 할수록 자꾸 끌려, 왜 자꾸, 자꾸 끌려, baby? I'm like TT, just like TT 이런 내 맘 모르고, 너무해, 너무해 I'm like TT (Oh), just like TT (Oh) Tell me that you'd be my baby 어처구니 없다고 해 얼굴 값을 못한대 전혀 위로 안돼, ba-ba-ba-baby 미칠 것 같애 이 와중에 왜 배는 또 고픈 건데? 하루 종일 먹기만 하는데 맴매매매 아무 죄도 없는 인형만 때찌 종일 앉아있다가 엎드렸다 시간이 획획획 피부는 왜 이렇게 또 칙칙? 자꾸 틱틱 거리고 만 싶지 엄만 귀찮게 계속, 왜, 왜, 왜, 왜, 왜? Na-na-na, na-na-na-na 콧노래가 나오다가 나도 몰래 짜증날 것 같아, 화날 것 같아 이런 애가 아닌데 I love you so much 이미 난 다 컸다고 생각하는데 어쩌면 내 맘인데 왜 내 맘대로 할 수 없는 건 왜? 밀어내려고 하면 할수록 자꾸 끌려, 왜 자꾸, 자꾸 끌려, baby? I'm like TT, just like TT 이런 내 맘 모르고, 너무해, 너무해 I'm like TT (Oh), just like TT (Oh) Tell me that you'd be my baby 혹시 이런 나를 알까요? 이대로 사라져 버리면 안돼요 이번엔 정말 꼭꼭 내가 먼저 talk, talk 다짐뿐인 걸, 매번 다짐뿐인 걸, woah-oh 이미 난 다 컸다고 생각하는데 (컸다고 생각하는데) 어쩌면 내 맘인데 왜 내 맘대로 할 수 없는 건 왜? (내 맘대로 할 수 없는 건 왜?) 밀어내려고 하면 할수록 내 맘대로 할 수 없는 건 왜? I'm like TT, just like TT (Oh, ooh-woah) 이런 내 맘 모르고, 너무해, (너무해, baby) I'm like TT (Oh), just like TT (Oh; Oh, woah) Tell me that you'd be my baby"
"TWICE","Heart Shaker","2017","K-Pop","Yeah, yeah, yeah, yeah, yeah Come and be my love Come and be my love, baby Yeah, yeah, yeah, yeah, yeah Come and be my love Come and be my love, baby 멍하니 서서 막 고민고민 해 나 이거 진짜 잘하는 짓인지 Yeah, yeah, yeah, yeah (뭐 어때?) No, no, no, no (미쳤어) 난 쯔위라고 해, 무작정 인사할까?* **내 전화번호야**, *쪽지를 주고 도망칠까?* Yeah, yeah, yeah, yeah (**어떡해?**) No, no, no, no 지금이야 (Girl, you can do it) 눈이 마주치고 있잖아 (Love is timing) 놓치면 후회할지 몰라 Love is coming, coming 좀만 더 용길 내 *더는 망설이지마* 이상하게 생각해도 어쩔 수 없어 반했으니까 You're my heart shaker, shaker (놓치기 싫어) You're my heart shaker, shaker (어떡해?) 바보처럼 안 기다려 내가 말할래 반해버렸다고 네가 맘에 든다고 하루 종일 보고 싶다고 Would you be my love? 반해버렸으니까 표정관리 해, 어색하지 않게 말투는 cool, cool, 긴장할 필요없어 Yeah, yeah, yeah, yeah (정신 바짝 차리고 집중해) No, no, no, no (어떡해 똑바로 못 보겠어) 지금이야 (Girl, you can do it) 눈이 마주치고 있잖아 (Love is timing) 놓치면 후회할지 몰라 Love is coming, coming 좀만 더 용길 내 *더는 망설이지마* 이상하게 생각해도 어쩔 수 없어 반했으니까 You're my heart shaker, shaker (놓치기 싫어) You're my heart shaker, shaker (어떡해?) 바보처럼 안 기다려 내가 말할래 반해버렸다고 네가 맘에 든다고 하루 종일 보고 싶다고 Would you be my love? 반해버렸으니까 너도 날 원하게 될 거야 날 사랑하게 될 걸 간절히 바라 너도 나와 같기를 Oh, yeah 망설이지마, 먼저 다가가 사랑을 말해, 주저 하지마 *Come, baby, be my, be my, be my love* (Hey, hey) Come baby, bae, bae-bae, bae 이상하게 생각해도 (Woah, woah, yeah) 어쩔 수 없어 반했으니까 You're my heart shaker, shaker (놓치기 싫어; Baby, baby) You're my heart shaker, shaker (*어떡해?*) 바보처럼 안 기다려 (Ooh, yeah) 내가 말할래 반해버렸다고 네가 맘에 든다고 (Baby, yeah, no) 하루 종일 보고 싶다고 사랑한다고 **반해버렸다고** Yeah, yeah, yeah, yeah, yeah (Yeah, yeah, yeah) You're mine (Be mine) You're mine (Be mine; Yeah, yeah, yeah) Yeah, yeah, yeah, yeah, yeah 좋아한다고 말할래 반했으니까"
"TWICE","MORE & MORE (English Version)","2020","K-Pop","I know I want it I don't wanna hide, pretending I don't want it 'Cause I deserve it (Deserve it) I'm not worried What you'll think of me when you see what's inside me 'Cause I know you (I know you) Don't look away, look in my eyes (Hey) Show me your heart, do not disguise (Hey) You can run, but you cannot hide, no, no Even if you tell me goodbye (Hey) Whenever you open your eyes (Hey) You'll think of me, you're hypnotized (Yeah, yeah) You're gonna say more, more, more, more, more and more Can't help but say more, more, more, and more 'Cause you can’t get enough I wanna have more, more, more, more, more and more (And you will say more, more, more, and more) ('Cause it's never enough) More You'll be begging for more (More and more) 'Cause you can't get enough, -nough You'll be craving for more (More and more) 'Cause it's never enough Do you feel me? Or do you still not understand how much you love me? Boy, you need me, you want me Stop pretending I can see it in your eyes, you're already mine 'Cause I know you, I know you Even if you cover your ears (Ah) Push me away for years and years (Ah) In your heart, I won't disappear (Be right there), no, no If I ever call out your name (Ah) Your heart will feel just like the same (Ah) You are gonna be mine again And once again! You're gonna say more, more, more, more, more and more Can't help but say more, more, more, and more 'Cause you can’t get enough I wanna have more, more, more, more, more and more (And you will say more, more, more, and more) ('Cause it's never enough) More You'll be begging for more (More and more) 'Cause you can't get enough, -nough You'll be craving for more (More and more) 'Cause it's never enough (More) (More) I'm a greedy girl, sorry if you didn't know Take my apology because I want you more and more Gonna steal your heart, own it and won't let it go By then you'll understand you can't say no, no I'll be sneaking in your heart like a stray cat Conquer it and put my mark on it like a tat My love, so sweet the plan will never fall flat And once again! (More) You'll be begging for more (You're gonna say) (More and more) 'Cause you can't get enough, -nough ('Cause it's never enough) You'll be craving for more (More and more) (More and more) 'Cause it’s never enough (More)"
"TWICE","Strategy","2024","K-Pop","Hey, boy, I'ma get ya I'ma get you real good and I bet ya (It's Megan Thee Stallion) Hey, boy, once I get ya You'll be, oh, so glad that I met ya (And TWICE) Ow Step one, do my highlight Make me shine so bright in the moonlight Step two, silhouette tight Baby, even my shadow looks good, right? Step three, when I arrive Make you look my way with your heart eyes Step four, got you on the floor Make you say, ""More, more, more"" When I say hi I'm feeling all your attention on me Hi No reason to be so shy with me I ain't gonna bite, comе on over (No) I know you wanna move a little closеr (Yeah) I got a plan to get you with me I got you on my radar, soon you're gonna be with me My strategy, strategy will get ya, get ya, baby Winning is my trademark, soon you'll never wanna leave My strategy, strategy will get ya, get ya, baby Hey, boy, I'ma get ya I'ma get you real good and I bet ya Hey, boy, once I get ya You'll be, oh, so glad that I met ya When your cheeks go red (That's cute) I wanna dance, you said (""Oh, cool"") 'Til I'm in your head (It's cruel) And you can't forget You're feeling things now, and you're confused Watching my body getting loose You don't know what you're gonna do You're mine When I say hi I'm feeling all your attention on me Hi No reason to be so shy with me I ain't gonna bite, come on over (No) I know you wanna move a little closer (Yeah) I got a plan to get you with me I got you on my radar, soon you're gonna be with me My strategy, strategy will get ya, get ya, baby Winning is my trademark, soon you'll never wanna leave My strategy, strategy will get ya, get ya, baby (Real hot girl shh) Do you like that? (Huh?) When I smack it and you watch it bounce it right back? He really lost it when he saw me do the right, left (Hmm) I'm a man eater, you are just a light snack (Baow) I got him pressed like he's workin' on his triceps (Hmm) I'm a flirt, I'm a tease, they be hurt after me Told him, ""Baby, what's a player to the G-A-M-E?"" Sayin' need the word by him bringing me to the beach Jealous? Who? Girl, please Left, right, left, right, do it to the beat (Do it to the beat) Talk with my body, that's my strategy (Baow, baow) Other girls try but I'm really hard to beat (But I'm really hard to beat) He'll be mine off my strategy (Yeah, yeah) Left, right, left, right, do it to the beat (Do it to the beat) Talk with my body, that's my strategy (Baow, baow) Other girls try but I'm really hard to beat (Yeah, I'm really hard to beat) He'll be mine off my strategy (Yeah, yeah) My strategy, strategy Like gravity, gravity One look at me, look at me I bet ya, bet ya, bet ya, boy You'll be down on your knees Calling me up, begging me, don't leave My strategy, strategy Will get ya, get ya, get ya, boy (Ah-oh!) Hey, boy, I'ma get ya I'ma get you real good and I bet ya (Real good and I bet ya) Hey, boy, once I get ya You'll be, oh, so glad that I met ya (Oh, so glad that I, ooh) Hey, boy, I'ma get ya (Hey, boy, yeah) I'ma get you real good and I bet ya (Good and I bet ya) Hey, boy, once I get ya (Hey, boy) You'll be, oh, so glad that I met ya (Oh, so glad that I met ya) Hey, boy, I'ma get ya I'ma get you real good and I bet ya"
"TWICE","I CAN’T STOP ME","2020","K-Pop","Ooh, ooh, ooh Ooh, ooh, ooh-ooh 알람이 울려대, ring, ring-a-ling 서로의 눈길이 닿을 때마다 알면서 빙빙 도는데 점점 다가가잖아, I know it's too late 마음속으로는 다 알고 있잖아 결국에는 선을 넘게 될 거라는 걸 I'm warning to myself, 너 그러면 안 돼 매분, 매초, 내 맘이 내 맘을 추월해 Out of control (Hey) 나를 감시하는 저 spot, spot, spotlight 비출수록 어둠 속으로 빨려들어 끝이 보이는데, I know it's not right I can't stop me, can't stop me (No, woah, woah, hey) 내 앞에 놓여진 이 red, red, red line 건너편의 너와 난 이미 눈을 맞춰 느끼고 싶어 짜릿한 highlight I can't stop me, can't stop me (No, woah, woah) Ooh, ooh, ooh Ooh, ooh, ooh-ooh Ooh, ooh, ooh Ooh, ooh, ooh-ooh Ooh, ooh, ooh Ooh, ooh, ooh-ooh I can't stop me, can't stop me 눈감아 달라구 (Yah, yah) 딱 한 번만 no rules (Ah, ah) 모른 척 해줘, lights off tonight 나 참을 수 없을 거 같아, losing myself (Yeah, yeah) 이제는 turning back 불가능해 난 점점 더 깊은 어둠에 (깊은 어둠에) 너무나 짜릿해, 나 눈을 감을래 (Hey) 다시는 돌아갈 수 없을 것만 같애 Out of control (Ooh, yeah; Hey) 나를 감시하는 저 spot, spot, spotlight 비출수록 어둠 속으로 빨려들어 (Ooh, ooh, ooh) 끝이 보이는데, I know it's not right I can't stop me, can't stop me (No, woah, woah, hey) 내 앞에 놓여진 이 red, red, red line (Red line) 건너편의 너와 난 이미 눈을 맞춰 느끼고 싶어 짜릿한 highlight I can't stop me, can't stop me (I can't stop me, yeah) (No, woah, woah) Risky, risky, wiggy, 위기 This is an emergency Help me, help me, somebody stop me 'Cause I know I can't stop me 답은 알고 있잖아 근데 가고 있잖아 이러고 싶지 않아 내 안에 내가 또 있나봐 나는 원하는데 (Ah, ah) 원하는 게 안돼 (Ooh, ooh) Guilty, 난 싫은데 I can't stop me, can't stop me, can't stop me (Oh) 나를 감시하는 저 spot, spot, spotlight 비출수록 어둠 속으로 빨려들어 끝이 보이는데, I know it's not right I can't stop me, can't stop me (No, woah, woah, hey) 내 앞에 놓여진 이 red, red, red line 건너편의 너와 난 이미 눈을 맞춰 느끼고 싶어 짜릿한 highlight (Ooh, ooh, ooh, ooh, ooh) I can't stop me, can't stop me (Yeah, yeah, yeah) (No, woah, woah) Ooh, ooh, ooh Ooh, ooh, ooh-ooh (Ah, ah) Ooh, ooh, ooh Ooh, ooh, ooh-ooh (Ooh, ooh) Ooh, ooh, ooh Ooh, ooh, ooh-ooh I can't stop me, can't stop me No, woah, woah Ooh, ooh, ooh Ooh, ooh, ooh-ooh Ooh, ooh, ooh Ooh, ooh, ooh-ooh Ooh, ooh, ooh Ooh, ooh, ooh-ooh"
"Girls’ Generation (소녀시대)","Gee","2009","K-Pop","Uh-huh Listen, boy My first love story (Ooh-oh-oh, ooh-oh-oh, yeah) My angel (Ha) And my girls (Ha) My sunshine Uh, uh, let's go 너무, 너무 멋져, 눈이, 눈이 부셔 숨을 못 쉬겠어, 떨리는 girl Gee, gee, gee, gee, baby, baby, baby Gee, gee, gee, gee, baby, baby, baby Oh, 너무 부끄러워, 쳐다볼 수 없어 사랑에 빠져서 수줍은 girl Gee, gee, gee, gee, baby, baby, baby Gee, gee, gee, gee, ba—, ba-ba—, ba-ba-ba— (어떻게 하죠?) 어떡-어떡하죠? (떨리는 나는) 떨리는 나는요 (두근두근, 두근두근) 두근두근거려 밤에 잠도 못 이루죠 나는, 나는 바본가 봐요 그대, 그대밖에 모르는 바보 그래요, 그대 보는 난 너무 반짝반짝 눈이 부셔 No, no, no, no, no 너무 깜짝깜짝 놀라 나는 Oh, oh, oh, oh, oh 너무 짜릿짜릿, 몸이 떨려 Gee, gee, gee, gee, gee Oh, 젖은 눈빛, oh, yeah Oh, 좋은 향기, oh, yeah, yeah, yeah Oh, 너무, 너무 예뻐, 맘이 너무 예뻐 첫눈에 반했어, 꼭 집은 girl Gee, gee, gee, gee, baby, baby, baby Gee, gee, gee, gee, baby, baby, baby 너무나 뜨거워, 만질 수가 없어 사랑이 되버려, 후끈한 girl Gee, gee, gee, gee, baby, baby, baby Gee, gee, gee, gee, ba—, ba-ba—, ba-ba-ba— (어쩌면 좋아?) 어쩌면 좋아요? (수줍은 나는) 수줍은 나는요 (몰라, 몰라, 몰라, 몰라) 몰라, 몰라 하며 매일 그대만 그리죠 친한 친구들은 말하죠 ""정말 너는 정말 못 말려, 바보"" 하지만 그댈 보는 나 너무 반짝반짝 눈이 부셔 No, no, no, no, no 너무 깜짝깜짝 놀라 나는 Oh, oh, oh, oh, oh 너무 짜릿짜릿, 몸이 떨려 Gee, gee, gee, gee, gee Oh, 젖은 눈빛, oh, yeah Oh, 좋은 향기, oh, yeah, yeah, yeah 말도 못했는걸 너무 부끄러워 하는 난 (Ooh-oh-oh, ooh-oh-oh, yeah) 용기가 없는 걸까? (Ha) 어떡해야 좋은 걸까? (Ha) 두근두근 맘 졸이며 바라보고 있는 난 너무 반짝반짝 눈이 부셔 (Oh) No, no, no, no, no (Ha) 너무 깜짝깜짝 놀라 나는 (Oh, woah-oh, yeah) Oh, oh, oh, oh, oh 너무 짜릿짜릿, 몸이 떨려 (떨려와) Gee, gee, gee, gee, gee Oh, 젖은 눈빛, oh, yeah Oh, 좋은 향기, oh, yeah, yeah, yeah (눈이 부셔) 너무 반짝반짝 눈이 부셔 (No, no, no) No, no, no, no, no 너무 *깜짝깜짝 놀라 나는* (Oh, oh, oh) Oh, oh, oh, oh, oh 너무 짜릿짜릿, 몸이 떨려 (떨려와) Gee, gee, gee, gee, gee Oh, 젖은 눈빛, *oh, yeah* Oh, 좋은 향기, *oh, yeah, yeah, yeah*"
"Girls’ Generation (소녀시대)","The Boys","2011","K-Pop","겁이 나서 시작조차 안 해봤다면 그댄 투덜대지 마라 좀 (GG) 주저하면 기회는 모두 너를 비켜가 가슴 펴고 나와봐라 좀 (TRX) Bring the boys out Yeah, you know B-bring the boys out We bring the boys out, we bring the boys out Yeah B-bring the boys out 순리에 맞춰 사는 것 넌 길들여져 버렸니? 괜찮니? (Get up) 암담한 세상이 그댈 주눅 들게 만드니? (That's funny) 괜찮니? 그냥 볼 수가 없어 난, 부딪히고 깨져도 몇 번이고 일어나 (Ah, ah, ah, ah) 날카롭게 멋지게 일을 내고야 말던 (Ah, ah) 네 야성을 보여줘 My boy (Ah, ah, ah) B-bring the boys out Girls' Generation make you feel the heat 전 세계가 너를 주목해 B-bring the boys out 위풍도 당당하지, 뼛속부터 넌 원래 멋졌어, *you know the girls* B-bring the boys out 흔들리지 말고 그댄 자릴 지켜 원래 전쟁 같은 삶을 사는 인간인 걸 너는 왜 (Yeah, fly high), 벌써 왜 (You, fly high) 포기해? Oh, 넌 멀었잖아 너의 집념을 보여줘 (Yeah), 지굴 좀 흔들어줘 (Yeah) 모두가 널 볼 수 있게 (Ah, ah, ah, ah) 역사는 새롭게 (Yeah) 쓰여지게 될 걸 (Come on, come on) 주인공은 바로 너 (Ha-ha-ha-ha-ha-ha) 바로 너 (Ha-ha-ha-ha-ha-ha) B-bring the boys out (Bring the boys out) Girls' Generation make you feel the heat 전 세계가 너를 주목해 B-bring the boys out 위풍도 당당하지, 뼛속부터 넌 원래 멋졌어, *you know the girls* B-bring the boys out Girls bring the boys out I wanna dance right now 내가 이끌어줄게, come out 세상 남자들이여, 난 number one 지혜를 주는 Athena, check this out 즐겨봐라 도전의 설레임 이미 모두 가진 세상의 남자 그대로 쭉 가는 거야, keep up Girls' Generation, we don't stop (B-bring the boys out) 막혀 버렸던 미래가, 안 보였던 미래가 네 눈앞에 펼쳐져 점점 더 완벽한 네 모습에 마치 난 빨려 들 것 같아, my heart 겁이 나서 시작조차 안 해봤다면 그댄 투덜대지 마라 좀 (Just bring the boys out) 주저하면 기회는 모두 너를 비켜가 가슴 펴고 나와봐라 좀 (Bring the boys out) 'Cause the girls bring the boys out Girls bring the boys out Girls bring the boys out Girls bring the boys out Girls' Generation make you feel the heat 전 세계가 너를 주목해 B-bring the boys out 세상을 이끌 남자 멋진 여자들 여기 모여라, *you know the girls* B-bring the boys out"
"Girls’ Generation (소녀시대)","소원을 말해봐 (Genie)","2009","K-Pop","아, 빨리 가고 싶다 아, 바다 좋다, 그쵸? Turn it up (Let's go) Just turn it up (빨리 달리고 싶다, let's go, woo, yes) That's right (Woah, woo, haha) Come on 소원을 말해봐 네 맘속에 있는 작은 꿈을 말해봐 네 머리에 있는 이상형을 그려봐 그리고 나를 봐 난 너의 genie야, 꿈이야, genie야 드림카를 타고 달려봐 넌 내 옆자리에 앉아 그저 내 이끌림 속에 모두 던져 가슴 벅차 터져 버려도 바람결에 날려 버려도 지금 이 순간 세상은 너의 것 그래요, 난 널 사랑해, 언제나 믿어 꿈도 열정도 다 주고 싶어 난 그대 소원을 이뤄주고 싶은 행운의 여신 소원을 말해봐 I'm genie for you boy (Come on) 소원을 말해봐 I'm genie for your wish 소원을 말해봐 I'm genie for your dream 내게만 말해봐 I'm genie for your world 소원을 말해봐 지루한 날들이 넌 지겹지 않니? 평범한 생활에 넌 묻혀버렸니? 이제 그만 깨어나 넌 나의 superstar, shining star, superstar 심장 소리 같은 떨림의 (떨림의) Harley 에 몸을 맡겨봐 (Yeah) 이제 이 세상은 오직 너의 무대 (Oh, woah) 환호 소리 같은 파도가 내 가슴엔 너의 체온이 (오직 너) 나는 너의 길 ,영원한 biggest fan 그래요, 난 널 사랑해, 언제나 믿어 (난 널 믿어) 꿈도 열정도 다 주고 싶어 난 그대 소원을 이뤄주고 싶은 (싶은; 이뤄줄게) 행운의 여신 소원을 말해봐 I'm genie for you boy (Come on) 소원을 말해봐 I'm genie for your wish (*Come on*) 소원을 말해봐 I'm genie for your dream 내게만 말해봐 I'm genie for your world 소원을 말해봐 Woo-hoo, let's go Aha, yeah Ahaha, ahaha, woo DJ, put it back on 그래요, 난 널 사랑해, 언제나 믿어 (Oh) 꿈도 열정도 다 주고 싶어 (싶어) 난 그대 소원을 이뤄주고 싶은 (싶은) 행운의 여신 (소원을 말해봐) 난 널 사랑해, 넌 나의 music (너의 fantasy를 숨김없이 말해봐) 난 널 사랑해, 넌 나의 기쁨 (나는 genie 길을 보여줄게) 난 널 사랑해, 난 너의 행운 (네가 가진 소원 숨김없이 말해봐) -이 되고 싶어 (너의 genie 내가 들어줄게) 소원을 말해봐 I'm genie for you boy 소원을 말해봐 I'm genie for your wish (Hey, baby) 소원을 말해봐 I'm genie for your dream (*Boy, uh-huh*) 내게만 말해봐 I'm genie for your world 소원을 말해봐 (Woah) I'm genie for you boy 소원을 말해봐 I'm genie for your wish 소원을 말해봐, 소원을 말해봐 (와, 나 바다 보고 싶어, 같이 가자) 소원을 말해봐, 소원을 말해봐 (같이 가자, let's go, yeah, woo) 소원을 말해봐, 소원을 말해봐 (Woo, haha, 가자, 가자) 소원을 말해봐 (Shh), 나한테만 말해봐 (어?; 다 나한테만 말해봐, ahaha)"
